pair_ID	sentence_AB	E_judgment
3268	the girl is recklessly jumping onto a car [SEP] the girl is recklessly jumping onto a vehicle	0
3269	a male child on a hill covered in snowfall is wearing a red jacket and a black hat and is sliding on his knees [SEP] the child is still in the snowfall	0
3270	a adult male is diving off a drop [SEP] a adult male is riding a bike	2
3271	there is no adult male drinking orange juice and walking on a sunny solar day [SEP] a adult male is drinking orange juice and walking	1
3272	a lady is putting on make-up [SEP] a adult female is putting on make-up	0
3273	two dogs are cheerfully playing on the beach [SEP] two dogs are playing on the beach	0
3274	a true cat is playing a pianoforte [SEP] a true cat vocal is being played on a pianoforte	2
3275	two boys are wearing brown shirts and are tugging at a rope on a wooden platform [SEP] two twin preteen boys are dueling with sticks	2
3276	a young male child is jumping in the air with his knees bent and arms spread [SEP] there is no young male child jumping in the air with his knees bent and arms spread	1
3277	a tiger rookie is roaring [SEP] a tiger is walking around	2
3278	mark linguistic communication is being used by a young girl [SEP] a girl is communicating with mark linguistic communication	0
3279	a adult female is surfing [SEP] a fearful little male child is on a climbing wall	2
3280	a domestic dog is chasing a ball in the grass [SEP] a ball is being chased by a domestic dog on the grass	0
3281	a domestic dog with a blue neckband is not playing with the ball outside [SEP] a domestic dog with a blue neckband is playing with the ball outside	1
3282	a adult male is cutting a roll [SEP] a adult male is slicing a tomato	2
3283	a adult male is falling off a mechanical bull [SEP] a adult male is riding a mechanical bull	2
3284	an onion is being sliced by a adult male [SEP] an onion is being cut by a adult male	0
3285	a adult female is skiing down a hill and over a red obstruction [SEP] a adult male is snowboarding down a railing in the snowfall	2
3286	a domestic dog is turning on the grass and pursuing a flying lawn tennis ball [SEP] a yellow domestic dog is chasing a ball	2
3287	a little girl is selling a sea scooter [SEP] a little girl is peddling a sea scooter	2
3288	a male child is happily playing the pianoforte [SEP] one male child is happily playing a pianoforte	0
3289	one adult male is riding a horse [SEP] the adult male is riding a horse	0
3290	a girl is wearing jeans and a pink shirt and is running [SEP] a girl is running with a pink shirt and is not wearing jeans	2
3291	a adult male is playing a large transverse flute [SEP] a transverse flute is being played by a adult male	0
3292	a adult male is putting down the transverse flute [SEP] the adult male is playing a guitar	2
3293	two child are bouncing on colorful balls [SEP] the child are wearing black leotards and hopping	2
3294	there are no dogs fighting for a frisbee in a lake [SEP] two brown dogs are playing with a frisbee in the water	2
3295	a adult male in a purple suit of clothes is standing by a purple example and is playing a guitar [SEP] the adult male is putting away the guitar in the guitar example	2
3296	the domestic dog in the dyed red waistcoat is running in the field [SEP] the domestic dog in the red waistcoat is running in the field	0
3297	one young lady is jumping on the car [SEP] one girl is jumping on the car	0
3298	some rockers are getting airborne on a path near water and a skyline [SEP] some rockers are not getting airborne on a path near water and a skyline	1
3299	a adult male with a helmet painted red is riding a blue bike down the route [SEP] a motorcyclist with a red helmet is riding a blue bike down the route	0
3300	a male child in a swimwear is sitting on top of a circular fountain [SEP] the male child is standing next to the opening of a fountain	2
3301	there is no kid playing with a water spout outdoors with the residue of his family watching [SEP] a male child is holding a hosiery next to a adult male and another male child is watching	2
3302	a visible light brown domestic dog is running up a street [SEP] the visible light brown domestic dog is running up a street	0
3303	the male child in blue is running away from the adult female in blue [SEP] a male child in blue is running away from a adult female in blue	0
3304	two boys are laying in the ocean close to the beach [SEP] two boys are laying in the ocean far to the beach	1
3305	two dogs of different breeds are looking angrily at each other across a street [SEP] two dogs of different breeds are looking at each other across a street	0
3306	two bmx rockers are jumping soil ramps in front of a organic structure of water [SEP] some rockers are doing tumbling on a path near water and a skyline	2
3307	a adult female is amalgamating eggs [SEP] a adult female is mixing eggs	0
3308	a few child are jumping on a trampoline [SEP] some child are jumping on a trampoline	0
3309	the mortal is flying through the air on a bike [SEP] the mortal is not flying through the air on a bike	1
3310	the nutrient on the trays isnt being eaten by the kittens [SEP] the nutrient on the trays is being eaten by the kittens	1
3311	no domestic dog is in the sand that is blowing in the air current [SEP] a domestic dog is in a sandy country with the sand that is being stirred up into the air and several plants are in the background	1
3312	the brown dogs are not playfully fighting on the sandy beach [SEP] a brown domestic dog and a red domestic dog are frolicking on the beach	2
3313	a white car is being driven by the adult male [SEP] an interview is being granted by the adult male	2
3314	a blond kid is going down a microscope slide and throwing up his arms [SEP] a young girl with a bosom army tank top is raising her hands as she is sliding	2
3315	a domestic dog is running on the route [SEP] a adult male is running on the route	2
3316	a adult male with a white mustache is sitting on a balcony and is looking at the route below [SEP] a adult male is leaning on the shelf of a balcony	2
3317	a stone is being climbed by a mortal with a rope which is pink [SEP] one adult male is climbing a drop with a rope	0
3318	a domestic dog which is large and gray is carrying a ball in its mouth and running across the grass [SEP] a domestic dog of large size is running on the grass with a lawn tennis ball in its mouth	2
3319	some boys are kneeling next to each other in front of a ball [SEP] the young boys are posing with a green association football ball in a parkland	2
3320	the male child is playing in the clay [SEP] there is no true cat playing with a device	2
3321	the white caribou wearing domestic dog ears is near a brown caribou [SEP] the white domestic dog wearing caribou ears is near a brown domestic dog	2
3322	a adult female is snowboarding down an side and another adult female is standing behind her [SEP] there is no adult female snowboarding down an side and there is no other adult female standing behind her	1
3323	two boys are doing martial humanities on a blue mat [SEP] two boys in white outfits and red protective cogwheel are sparring on a mat	2
3324	the football game is between the feet of a male child who is lying on the grass [SEP] the little child is playing football game and falling into the grass	2
3325	a girl in a uniform is playing the transverse flute with a marching band [SEP] a girl in a band is playing an instrument	0
3326	a adult female is clumsily putting meat in a cooking pan [SEP] a adult female is putting meat in a cooking pan	0
3327	women are not wearing bunny girl ears and race numbers and are not pointing at something in the distance [SEP] women are wearing bunny girl ears and race numbers and are pointing at something in the distance	1
3328	a adult male and a adult female are eating [SEP] a adult male and a adult female are having a conversation	2
3329	a adult male and two women in a darkened room are sitting at a table with candles [SEP] the group of people is sitting in a dim room	0
3330	some men are fighting [SEP] a group of men is fighting	0
3331	a adult male in blue is riding a horse on a soil route [SEP] a adult male is riding a dirty horse on a blue route	2
3332	the adult male dressed in leather chaps and a purple shirt is standing in front of someone lookers [SEP] a adult male is not wearing a purple shirt and black leather chaps and is posing for the photographic camera	2
3333	a mortal is cutting a pepper into pieces [SEP] the mortal is not slicing a clove of allium sativum into pieces	0
3334	a box is being cut by a adult male [SEP] the adult male is cutting the tape on the box	2
3335	a domestic dog is walking away from a infant [SEP] a domestic dog is licking a infant	2
3336	a band is not playing some instruments [SEP] a adult male is playing an electronic keyboard	2
3337	several swimmers are jumping into the water [SEP] swimmers are racing in a lake	2
3338	a brown and white domestic dog is jumping in the air with a lawn tennis ball in its mouth [SEP] a ball is being caught by a domestic dog in mid air	2
3339	a mortal is climbing a stone with a rope which is pink [SEP] a social climber is tying a adult male to a drop with a rope	2
3340	a mortal is standing in a vast field of glacial water ice [SEP] one mortal is standing in a vast field of glacial water ice	0
3341	a adult male is slicing a tater into pieces [SEP] a adult male is not cutting a tater	1
3342	a true cat is playing with a watermelon vine [SEP] the true cat isnt playing with a watermelon vine	1
3343	a mortal in a blue jacket is jumping off of a tall cement wall [SEP] a mortal in a blue colored jacket is jumping off of a tall cement wall	0
3344	a infant rhinoceros is walking around a pen with its female parent [SEP] a infant rhinoceros is following an grownup rhinoceros	0
3345	a adult male is playing a guitar [SEP] a guitar is being played by a adult male	0
3346	the adult male is cutting cooked octopus [SEP] the adult female is cutting cooked octopus	2
3347	a kid is playing with a water spout outdoors and the residue of his family is watching [SEP] a male child is holding a hosiery next to a adult male and another male child is watching	2
3348	a adult male is punching a association football ball [SEP] a adult male is kicking a association football ball	2
3349	a small fauna is singing [SEP] a mortal is slicing some onions	2
3350	a adult male is mowing a lawn [SEP] a black and white domestic dog is playing with a tattered volleyball game in a brown field	2
3351	the piece of paper is not being cut [SEP] the piece of paper is being cut	1
3352	three men are sitting on a hill and looking at the mountains and sky [SEP] some meat is being stitched together by a adult female	2
3353	there is no adult male holding a mark and seeking money [SEP] a bearded adult male is standing by a shopping cart and is holding a composition board mark	2
3354	a few men are cheerfully playing cricket [SEP] people are playing cricket	0
3355	a male child under an umbrella is being held by his father who is wearing a blue coat [SEP] a kid is experiencing a new cosmos	2
3356	butter is being chopped into a container by a adult male [SEP] a adult female is cutting shrimps	2
3357	mimes are performing on a small phase [SEP] mimes are performing on a phase	0
3358	a adult female is using a sewing machine [SEP] there is no adult female using a sewing machine	1
3359	a football game participant in a red and white uniform is being lifted by two teammates [SEP] some football game players in red and white are jumping and hugging	2
3360	a shrimp is being cut by a adult female [SEP] a adult female is cutting shrimps	2
3361	a group of people are not dancing at a concert [SEP] a group of people are dancing at a concert	1
3362	a adult male in a motocross uniform is wearing a helmet and rides a red bike [SEP] a mortal in a motocross uniform is wearing a helmet and rides a red bike	0
3363	a big domestic dog and a small white domestic dog are walking past each other [SEP] a big domestic dog and a small white domestic dog are playing together	2
3364	a adult male is removing the butter from a piece of breadstuff which is big [SEP] a adult male is spreading butter on a piece of breadstuff which is big	2
3365	a plaything railroad train is striking a plaything car [SEP] a plaything railroad train is missing a plaything car	1
3366	a bike is being ridden by the little male child in a race [SEP] a young male child in a helmet is riding a motorcycle on the route	2
3367	a adult male is walking along a path through a wilderness [SEP] a adult male is peeling an onion	2
3368	a white and brown domestic dog is walking through the water with trouble [SEP] a white and brown domestic dog is pacing through the water with trouble	0
3369	a few men in a competition are running outside [SEP] a adult male is leading the race	2
3370	a young girl in a blue unitard is jumping on the earth [SEP] a young girl in a blue unitard is jumping in the air	2
3371	a adult male is buttering a piece of breadstuff [SEP] a adult female is buttering a piece of breadstuff	2
3372	a skateboarder is jumping in the air [SEP] a adult male in a red shirt is doing a fast one with the rollerblades	2
3373	the girl has red hair and eyebrows several piercings in a ear and no tattoo on the back [SEP] a girl with red hair and red eyebrows is in midspeech	2
3374	a talented adult male is playing the guitar [SEP] a adult female is playing a guitar	2
3375	a transverse flute is being played by a girl [SEP] a transverse flute is being put away by a girl	1
3376	a seated adult female is singing a vocal and playing the guitar [SEP] the adult male isnt lifting weights	2
3377	a adult male is squatting in brushwood and taking a picture [SEP] a adult female is crouching and holding a photographic camera	2
3378	a adult female is standing in the water at the base of operations of a falls [SEP] a adult male is standing in the water at the base of operations of a falls	2
3379	a laughing kid is holding a water gun and getting sprayed with water [SEP] a kid with a gun that sprays water is laughing and getting hit by other boys	2
3380	someone is banging a photographic camera lense against a nail [SEP] there is no one banging a photographic camera lense against a nail	1
3381	the muscular black adult male is dancing and the adult male behind him is wearing green string of beads [SEP] the muscular white adult male is dancing and the adult male behind him is wearing green string of beads	2
3382	the adult female is picking up a kangaroo that is little [SEP] the adult female is picking up the kangaroo	0
3383	a girl from asia in front of a window made of bricks looks surprised [SEP] a girl is wearing a tshirt and has her mouth open	2
3384	a toad is being held carelessly by a adult male [SEP] a adult male is carelessly holding a toad	0
3385	a adult male is making a bed [SEP] a mortal is making a bed	0
3386	the adult male is catching a fish [SEP] a adult female is deboning a fish	2
3387	nobody is treading through the snowfall of the beautiful snowy landscape [SEP] some people are treading through the snowfall of the beautiful snowy landscape	1
3388	some cameras are being burned by a mortal with a blow torch [SEP] the mortal is setting fire to the cameras	0
3389	the true cat is playing passionately with a watermelon vine [SEP] the true cat is playing with a watermelon vine	0
3390	the girl is carrying a mark and a group of people is following her [SEP] the girl is carrying a mark and is being followed by a group of people	0
3391	a bee is clinging to a yellow flower [SEP] a yellow flower is being clung to by a bee	0
3392	a domestic dog with a gun muzzle and a blue jacket is resting in the pace [SEP] a domestic dog with a gun muzzle and a blue jacket is running around the pace	2
3393	some teenage girls are dancing for the photographic camera [SEP] some teenage girls are standing still in front of the photographic camera	2
3394	a blonde adult male is hanging by gymnastic ropes [SEP] people are dangling from straps and kicking at each other	2
3395	a adult male on inline skates is skating at a skate parkland [SEP] a adult male on inline skates is skating at a parkland built for skating	0
3396	a girl is brushing her hair [SEP] a girl is styling her hair	0
3397	a adult female wearing a blue shirt and high heels is standing on the pavement next to the adult male [SEP] a adult male and a adult female are standing on the kerb	2
3398	one adult male is climbing a drop with a rope [SEP] a mortal with pink climbing cogwheel roped the stone	2
3399	the adult male at the beach is not doing a handstand on the wet sand at the border of the water [SEP] the adult male is doing a handstand on the wet sand at the border of the water at the beach	1
3400	a adult male is sitting on the beach [SEP] a adult male is performing a handstand on the beach	2
3401	a adult male is participating in a bmx race [SEP] a adult male is not participating in a bmx race	1
3402	hay is being eaten by a moo-cow [SEP] a moo-cow is eating hay	0
3403	the adult male in the purple hat isnt operating a photographic camera that makes picture [SEP] the adult male in the purple hat is operating a photographic camera that makes picture	1
3404	a adult female is playing the fiddle [SEP] there is no adult female playing the fiddle	1
3405	a young girl with painted human face is standing next to some other child [SEP] child are being dressed in costumes and playing a game	2
3406	a chef is discarding some nutrient [SEP] a chef is preparing a repast	2
3407	the women are not dancing outside [SEP] a group of people are dancing	2
3408	a adult male is sprinkling shredded cheese on a pizza pie [SEP] a adult male is putting seasoning on a pizza pie	2
3409	pedestrians and cars are moving through a traffic jam in a big metropolis [SEP] pedestrians and cars are moving through a traffic jam in the big metropolis	0
3410	a adult male is playing the guitar [SEP] an octopus is being sliced by a adult female	2
3411	the adult male is intensely playing the guitar [SEP] the adult male isnt intensely playing the guitar	1
3412	there is no cook slicing some bell peppers [SEP] the mortal is dicing up a black pepper which is orange	1
3413	there is no one typing [SEP] someone is typing on a keyboard	1
3414	a adult female is tapping her fingers [SEP] a adult female is resting her fingers on a table	2
3415	the girl isnt jumping onto the car recklessly [SEP] one girl is jumping on the car	2
3416	a brown and white domestic dog with a brown and black bandana is running very fast [SEP] a small white domestic dog is running across a lawn	2
3417	two people dressed in green and red costumes are outside on the sea-coast [SEP] two people dressed in green and red costumes are outside on the pavement	2
3418	a pelt scarf is being held by an asian adult female [SEP] an asian adult female is holding a pelt scarf	0
3419	the piece of paper is being cut [SEP] there is no paper being cut with pair of scissors	2
3420	a adult male is riding a horse in a sandy land [SEP] a guy is riding a horse	0
3421	a adult male is wearing a hard hat and dancing [SEP] there is no adult male with a hard hat dancing	1
3422	a domestic dog is herding a group of white sheep on a dusty farm [SEP] a domestic dog is herding a plurality of white sheep on a dusty farm	0
3423	there is no girl in pink twirling a thread [SEP] the girl is wearing a white shirt and a pink skirt and is standing in front of a house	2
3424	a adult male is arranging the garden [SEP] a adult male is mowing a lawn	2
3425	a adult male is crouching and holding a photographic camera [SEP] there is no tiger rookie making a sound	2
3426	there are no people flipping the tires of a tractor [SEP] two men are competing in a tyre rolling race	2
3427	there is no adult male playing a guitar [SEP] a adult male is playing a guitar	1
3428	the mortal is riding a minibike on a sandy path [SEP] a adult male is riding a minibike in the event related to motocross	2
3429	a mortal is strongly whisking eggs in a bowl [SEP] there is no adult female beating two eggs in a bowl and using a whisk made of wire	1
3430	a sketch plane is landing [SEP] a airplane is landing	0
3431	a parrot is speaking [SEP] the parrot is silent in front of the mike	1
3432	a male child is happily playing the pianoforte [SEP] a pianoforte isnt being played by a adult male	2
3433	a black sheep is standing far from three white dogs [SEP] the white dogs are looking curiously at the black llama	2
3434	a dirty tan domestic dog is rolling in the soil and looking right at the photographic camera [SEP] a domestic dog is sleeping on the earth	2
3435	no group of people is gathering at a base at the carnival [SEP] the people are standing at a carnival	2
3436	the adult female in jeans is sitting on the saddle of a horse [SEP] a mortal wearing jeans is sitting on top of a horse saddle	0
3437	a black domestic dog is jumping off a dock into a pool [SEP] a black domestic dog is jumping on a dock into a pool	0
3438	the adult male is setting up the photographic camera and taking sundown pictures at the beach [SEP] the adult male is putting away the photographic camera and walks away from the beach	1
3439	a mortal is cutting some ginger [SEP] an onion is being sliced by a mortal	2
3440	a monkey is wading through a marshland [SEP] a monkey is wading through a river	2
3441	a adult female is crouching down next to a domestic dog and is smiling at a little girl sitting on the pavement [SEP] a adult male is crouching down next to a domestic dog and is smiling at a little girl sitting on the pavement	2
3442	there is no adult male riding a horse [SEP] the mortal is riding the horse	2
3443	three dogs are resting on a pavement [SEP] the adult female with a knife is slicing a black pepper	2
3444	a kid is smiling at the photographic camera and swimming submerged [SEP] a kid is swimming submerged in a pool	2
3445	a domestic dog is running through the white snowfall [SEP] a domestic dog is running through the snowfall	0
3446	a brown and white domestic dog is jumping over a red yellow and white hurdle [SEP] a large brown true cat is jumping over a red hurdle	2
3447	a adult male and a young male child are riding in a yellow kayak [SEP] a adult male and a young male child are jumping off of a yellow kayak	2
3448	the adult male is dancing [SEP] three women are standing still	2
3449	two bmx rockers are jumping soil ramps in front of the water [SEP] some rockers are getting airborne on a path near water and a skyline	0
3450	a adult male is riding the fauna [SEP] a adult male is riding a minibike	2
3451	there is no adult female pouring ingredients into a bowl [SEP] a adult female is pouring ingredients into a bowl	1
3452	a adult male in a blue cowman hat is riding a white horse [SEP] a adult male in blue is riding a horse on a soil route	2
3453	a adult male is performing a leap on a bike [SEP] a bicyclist is performing a leap on a bike	2
3454	a adult female is putting on make-up carefully [SEP] the band is singing	2
3455	a skateboarder is doing tricks on a one-half tobacco pipe [SEP] a adult male is skateboarding on a one-half tobacco pipe	0
3456	the muscular black adult male is dancing and the adult male behind him is wearing green string of beads [SEP] the shirtless adult male in striped shorts and shades is standing near a adult male in a white shirt and shades	2
3457	two men are riding an orange raft on the shore [SEP] two men are getting off of an orange raft on the shore	2
3458	the adult male is standing on a rocky mount and gray clouds are in the background [SEP] a black topless mortal is packing a mound of rocks and a front of clouds are in the background	2
3459	a black domestic dog and a small white and black domestic dog are looking up at a kitchen countertop [SEP] a large domestic dog and a small domestic dog are standing next to the kitchen counter and are sniffing	2
3460	a adult male is riding a minibike [SEP] a adult male is driving a minibike	0
3461	a adult male is playing an electric guitar [SEP] a group of people is holding drinks and pointing at the photographic camera	2
3462	a adult male is hurriedly getting into a car in a garage [SEP] a adult male is getting into a car	0
3463	a mortal is cleaning a pot of cooking oil [SEP] a mortal is pouring olive oil into a pot on the range	2
3464	a girl dressed in purple and blue is walking beside her motorcycle at dark [SEP] a adult female in a purple top is walking a bike between two rock columns	2
3465	someone is playing a pianoforte [SEP] a guitar is being played by a adult male	2
3466	some corndogs are being eaten by two toddlers who are in a waggon which is really small [SEP] two young child are eating corndogs	0
3467	a adult male is putting allium sativum on some breadstuff piece [SEP] a mortal is sprinkling seasoning on several sliced and buttered loaf of breadstuff	2
3468	a plump faced male child is wearing shades [SEP] a male child is wearing shades	0
3469	a small monkey is walking in the river [SEP] a monkey is wading through a marshland	2
3470	two football game players are scrambling for the ball on the judicature [SEP] two basketball game players are scrambling for the ball on the judicature	2
3471	a young oriental girl is standing above the crowd and is playing with a aeonium haworthii [SEP] a young oriental girl is standing above people and is playing with a aeonium haworthii	0
3472	the black domestic dog is running through the grass [SEP] the black domestic dog is not running through the grass	1
3473	an octopus is being sliced by a adult female [SEP] a adult female is slicing an octopus	0
3474	a mortal in a black jacket is doing tricks on a minibike [SEP] the girl who is little is carefully combing her hair into a pony tail	2
3475	a adult male is untying a rope [SEP] a adult male is climbing a rope	2
3476	a adult male is cracking eggs [SEP] a adult male is talking to a adult female	2
