pair_ID	sentence_AB	E_judgment
1106	the adult male and the male child are standing at the underside of the steps which are outdoors [SEP] an grownup is in the amphitheatre and is talking to a male child	2
1107	a adult female is riding a horse [SEP] a adult male is opening a small packet that contains phone	2
1108	the adult male is playing the guitar [SEP] the mortal is playing the guitar	0
1109	a adult female is collecting the water from a rap in a mug [SEP] a male child is filling a hurler with water	2
1110	a adult male on a green motorcycle is performing tricks on a soil incline [SEP] a stuntman on a motorcycle is in the air near a organic structure of water	2
1111	a adult female is slicing an onion [SEP] a adult female is cutting an onion	0
1112	an e-mail is being read by a adult male [SEP] a mortal is peeling a banana tree	2
1113	a young male child is jumping and covering nearby wooden fence with grass [SEP] a young male child covered in grass is jumping near a wooden fence	2
1114	a adult male is showing off a small monkey [SEP] a adult male is holding a big fauna in one hand	2
1115	a barefoot adult female is sitting on a cover under a lavender umbrella [SEP] the adult male is sitting outside under a purple umbrella	2
1116	the mortal is slicing a clove of allium sativum into pieces [SEP] the mortal is not slicing a clove of allium sativum into pieces	1
1117	people wearing costumes are gathering in a wood and are looking in the same way [SEP] the little girl is looking at a adult male in costume	2
1118	the snowboarder is jumping off a snowfall covered hill [SEP] the snowboarder is jumping off a snowy hill	0
1119	a surfboarder is riding the moving ridge [SEP] the moving ridge is being ridden by a surfboarder	0
1120	a child is splashing in the ocean [SEP] two child are not playing in the breaker	2
1121	a group of people is equipped with cogwheel used for protection [SEP] a mortal in biking cogwheel is standing steadily in front of some mountains	2
1122	one adult male is dancing [SEP] a adult male is dancing	0
1123	a adult female is chopping up an octopus [SEP] a tot is sitting in a place	2
1124	a tree is being cut by a adult male with an ax [SEP] a adult male is chopping down a tree with an ax	0
1125	a kitty is playing with a blue rope plaything [SEP] the kitty is not playing with a plaything	1
1126	a young occidental girl is standing above the crowd and is playing with a aeonium haworthii [SEP] a young oriental girl is standing above the crowd and is playing with a aeonium haworthii	2
1127	a group of asian girls are standing by themselves [SEP] two girls are laughing and other girls are watching them	2
1128	the crowd is watching a football game game [SEP] a group of people playing football game is running in the field	2
1129	a big fish is catching a adult male [SEP] a adult male is catching a fish	2
1130	the adult female is penciling on eyeshadow [SEP] a adult female is applying cosmetics to her lid	0
1131	a adult female is slicing a fish [SEP] a adult female is not chopping allium sativum	2
1132	a adult male is thinking [SEP] there is no adult male thinking	1
1133	a kid is making a snowfall ball [SEP] a kid in orange is playing outdoors with a abronia elliptica	0
1134	some meat is being stitched together by a adult female [SEP] a lady is cutting up some meat	2
1135	a true cat is jumping into a box [SEP] a young adult male is talking to a leafage	2
1136	the mortal in the blue jacket is wearing a colorful helmet [SEP] a race car driver is sitting down and is motionless	2
1137	a adult male is wearing a red jacket and standing beside a yellow canoe on some boulders with water in the background [SEP] a adult male in a red jacket is standing next to a yellow kayak on some rocks by the ocean	2
1138	the adult male is aiming a gun [SEP] the adult male is handling a gun	0
1139	a young girl is standing on one leg [SEP] a young girl is standing still	2
1140	a adult male is wearing a blue checkered shirt and riding a monocycle in the street [SEP] a adult male is standing shirtless in the street	2
1141	there is no domestic dog barking at a ball [SEP] a domestic dog is swimming after a lawn tennis ball	2
1142	two men are leaving the phase [SEP] mimes are performing on a phase	2
1143	a domestic dog which is black and a white one are staring at each other in the street [SEP] a domestic dog which is black and another one which is white are staring at each other in the street	0
1144	a adult male with tattoos is lounging on a sofa and is looking for a pencil [SEP] a moo-cow is eating hay	2
1145	a little male child is running on the earth and playing with a little girl [SEP] the little male child is running on the earth and playing with a little girl	0
1146	a adult female is peppering green piece [SEP] the adult female with a knife is slicing a black pepper	2
1147	a white domestic dog is leaping from a cylindrical hay bale [SEP] a black domestic dog is leaping from a cylindrical hay bale	2
1148	a adult male is diving off a drop [SEP] there is no adult male diving off a drop	1
1149	there is no mortal on a motorcycle jumping through the air with the sun flaring through the motorcycle frame [SEP] a mortal on a motorcycle is jumping through the air and the sun is flaring through the motorcycle frame	1
1150	a adult male in a cap is playing a harp [SEP] a adult male in a hat is playing a harp	0
1151	there is no mortal pouring olive oil into a pot on the range [SEP] a mortal is pouring cooking oil into a pot	2
1152	a young black kid is standing on the border of a organic structure of water near some buckets [SEP] a male child next to some buckets of rags is not holding an physical object	2
1153	a adult male with tattoos is lounging on a sofa and holding a pencil [SEP] a tattooed adult male is on a couch and is holding a pencil	0
1154	a young girl in a wintertime coat is jumping off a bowlder into the sand at a beach [SEP] a girl is jumping off a stone and another is standing on it	2
1155	a tramp is on top of the mount and is dancing [SEP] there is no tramp dancing on top of the mount	1
1156	child are playing in a fountain that is spraying water from the earth [SEP] child are playing in earth fountains	0
1157	the panda bear bear is resting on the logs [SEP] the panda bear bear is lying on the logs	0
1158	a adult male and a adult female are walking together through wooded areas [SEP] a adult male and a adult female are walking through a wooded country	0
1159	the adult female is wearing a red jacket and holding a glass in front of the adult male in a white tshirt [SEP] a mortal is wearing a red jacket and carefully holding a beer	2
1160	a adult male is riding a horse in the desert [SEP] a horse is being ridden by a guy	0
1161	a adult male is playing the drums [SEP] a adult male is disassembling the tympan	2
1162	there is no little girl peddling a sea scooter [SEP] a little girl is peddling a sea scooter	1
1163	a barefoot adult female is sitting on a cover under a lavender umbrella [SEP] a barefoot adult female is standing over a cover near a lavender umbrella	2
1164	a mortal is wiping butter on a tray [SEP] there is no mortal buttering a tray	1
1165	a true cat is playing a pianoforte [SEP] a true cat is playing a keyboard	2
1166	a adult female in a bikini is pulling a domestic dog on a lead at the beach [SEP] a adult female in a bikini is pulling a true cat on a lead at the beach	2
1167	three men are dancing [SEP] a few men are dancing	0
1168	the child is happily sliding in the snowfall [SEP] a male child on a hill covered in snowfall is wearing a red jacket and a black hat and is sliding on his knees	2
1169	a domestic dog has its head outside a red and green gift bag [SEP] the red and brown domestic dog is digging its olfactory organ inside a vacation gift bag	2
1170	a adult female is peeling a tater [SEP] a tater is being peeled by a adult female	0
1171	a shoeless adult male in pajamas is looking toward the sky and is standing on the lawn tennis judicature [SEP] a adult male is wearing a blue shirt and walking shoeless on a lawn tennis judicature	2
1172	a adult female on a stone is lying on a cover and reading a book [SEP] a adult female is rocking over a cover lying on someone reading a book	2
1173	a large lawn tennis ball is being used to teach a domestic dog to run in the grass and catch it with its mouth [SEP] a domestic dog which is large and gray is carrying a ball in its mouth and running across the grass	2
1174	a adult male is eating some nutrient [SEP] the adult male is fasting	1
1175	a true cat is crawling under a piece of piece of furniture [SEP] there is no true cat sliding upside down under a sofa	2
1176	three child are running down a grassy hillside [SEP] three child are running down a hillside covered by grass	0
1177	a purple crowd of people is eating on various red lit eatery tables [SEP] a large group of asian people is eating at a eatery	2
1178	a adult male is parking a car in a garage [SEP] a adult male is getting into a car	2
1179	people are walking outside a building that has many murals on it [SEP] nobody is in front of the colorful building	2
1180	a adult male is pouring cleaner into the sink [SEP] the drums are being played by the adult male	2
1181	a adult male is playing a fiddle [SEP] the infant is not laughing and crawling	2
1182	the black and white domestic dog is running in a green pace [SEP] the black and white domestic dog is running outdoors	0
1183	a girl in gold and purple is holding a rainbow afghan [SEP] a adult male is squatting in brushwood and taking a picture	2
1184	a young male child is riding a soil motorcycle through the clay [SEP] there is no young male child riding a soil motorcycle through the clay	1
1185	the land near a white bird is being watered swiftly [SEP] a white bird is landing swiftly in the water	2
1186	people are riding two camels on the sand [SEP] two people are seated on a camel and another camel is in the foreground	2
1187	the girl is carrying a mark and a group of people is following her [SEP] a adult female is cleaning a mans human face	2
1188	a adult male is reading an e-mail [SEP] there is no adult male reading an e-mail	1
1189	a domestic dog which is large and gray is carrying a ball in its mouth and running across the grass [SEP] a large domestic dog is running on the grass with a lawn tennis ball in its mouth	0
1190	a adult male is pouring oil into a cooking pan [SEP] a adult male is pouring oil into a frypan	0
1191	a visible light brown domestic dog is running in the water [SEP] a tan domestic dog is splashing in the water on the bank of a river	2
1192	the adult female is putting away a transverse flute [SEP] a adult female is playing transverse flute	2
1193	a black domestic dog is sitting in the grass and keeping its mouth closed [SEP] a black domestic dog is running in the grass and its lingua is hanging out	1
1194	the adult male is sitting next to a birdcage [SEP] the adult male is standing next to a bird coop	2
1195	a adult male is talking on the telephone [SEP] a adult male is not talking on the telephone	1
1196	the adult male is doing a wheelie on a mount motorcycle [SEP] a adult male is riding on a bike with one wheel only	2
1197	a young girl in a bikini is jumping on the beach [SEP] a young girl in a bikini is sitting on the beach	2
1198	the rhinoceros is grazing on the grass [SEP] a fauna is grazing in a field	0
1199	five wooden stands are in front of each childs army hut [SEP] five child are standing in front of a wooden army hut	2
1200	a adult male is singing into an old mike [SEP] a adult male is singing into a mike	0
1201	three men are sitting on a versant and looking at the view with a brace of field glasses [SEP] three men are sitting on a hill and looking at the mountains and sky	2
1202	three asian child are dancing and a adult male is looking [SEP] three asian child are dancing and there is no adult male looking	1
1203	a blonds girl is surfing [SEP] a blond girl is riding the waves	0
1204	five child are standing close together and one child has a gun [SEP] five child are standing close together and none of the child has a gun	1
1205	the adult male is playing the guitar and has the guitar example open for donations [SEP] the adult male is putting away the guitar in the guitar example	1
1206	a adult male is squatting in brushwood and taking a picture [SEP] a adult male is crouching and holding a photographic camera	0
1207	five adults are sitting on rock stairs [SEP] people are sitting near a wall	2
1208	one male child in orange shorts is standing on a stone drop over the water and the other male child in black shorts is diving into the water [SEP] two males are standing on a drop border and one is jumping into the water	0
1209	three people are walking across a rope and wood span over a river [SEP] people are not walking across a rope span over a rocky watercourse	2
1210	the black and white domestic dog is running outdoors [SEP] the black and white domestic dog is sitting on a green pace	2
1211	a adult male in a blue jump suit is courageously performing a wheelie on a bike [SEP] the adult male is doing a wheelie with a bike on earth which is mostly barren	2
1212	a adult male a adult female and two girls are walking on the beach [SEP] a group of people is on a beach	0
1213	a domestic dog is running through the snowfall [SEP] no domestic dog is running through the snowfall	1
1214	the true cat perched on the table isnt looking out the window [SEP] the true cat perched on the table is looking out the window	1
1215	the black domestic dog is walking along a tree bole span over water [SEP] the black domestic dog is not walking along a tree bole span over water	1
1216	a lady is standing near three child [SEP] a adult female is standing near three child	0
1217	a girl is combing the hair of a little ponys tail [SEP] the girl who is little is combing her hair into a pony tail	2
1218	the brown domestic dog is not playing outdoors [SEP] the brown domestic dog is playing outdoors	1
1219	a adult male is riding an electric bike [SEP] there is no adult male riding an electric bike	1
1220	ferrets are climbing down from a shelf [SEP] several ferrets are climbing out of the coop	2
1221	a adult male is making a study [SEP] a adult male is drawing	0
1222	a adult female is showing a small domestic dog to an baby [SEP] a adult female is crouching down next to a domestic dog and is smiling at a little girl sitting on the pavement	2
1223	a falls is flowing calmly into a shallow pool [SEP] a falls is flowing into a shallow pool	0
1224	a big green ball is knocking a tater [SEP] a large green ball is missing a tater	2
1225	a adult male is wearing a straw hat and smoking a cigaret [SEP] the adult male in the straw hat is smoking a cigaret	0
1226	two people are sitting on a parkland bench on a sunny solar day [SEP] two people are sitting on a parkland bench on a hot solar day	2
1227	a father is in the swimming pool during his girl launch [SEP] the adult male is tossing a child into the swimming pool that is near the ocean	2
1228	a adult male in a shirt dyed purple is walking away from a adult male in a black shirt who is serious [SEP] a adult male in a shirt dyed purple is looking at a adult male in a black shirt who is doing a funny human face	0
1229	two girls are playing guitar [SEP] two men are talking	2
1230	few people are eating at red tables in a eatery without lights [SEP] a large group of asian people is eating at a eatery	2
1231	the black domestic dog is running through the grass [SEP] the black domestic dog is walking through the tall grass	1
1232	a brown domestic dog is running across the pace with a plaything in its mouth [SEP] a brown domestic dog is dropping a colored plaything from its mouth	2
1233	a adult male is cutting an onion [SEP] an onion is being sliced by a adult female	2
1234	the mortal is practicing the guitar [SEP] the guitar is being sold by a lady	2
1235	a adult male is jumping into an empty pool [SEP] the mans jumper is in the empty pool	2
1236	someone is cutting a tomato [SEP] the adult female is holding a whole tomato	2
1237	a adult female dressed in elegant clothing is inside a crowd of people and is looking down [SEP] a pelt scarf is being held by an asian adult female	2
1238	a adult male is shaking a container over a sink in the kitchen [SEP] there is no adult male shaking a container over a sink in the kitchen	1
1239	a young game is playing with a kid wearing a white coat [SEP] a young kid is wearing a white coat and playing a game	2
1240	two people are riding a motorcycle [SEP] a practicing jumper is tossing a persons snowboard into the air	2
1241	four child are doing backbends in the gymnasium [SEP] four girls are doing backbends and playing outdoors	2
1242	the adult female is cutting a carrot [SEP] an onion is being sliced by a adult female	2
1243	there is no young male child covered in grass jumping near a wooden fence [SEP] a young male child covered in grass is jumping near a wooden fence	1
1244	the adult female is not walking the domestic dog [SEP] the adult female is walking the domestic dog	1
1245	the girl is recklessly jumping onto a car [SEP] there is no girl jumping into the car	2
1246	the girl in blue is chasing the base of operations smuggler with a number on the jersey [SEP] the girl in blue is chasing the participant with a number on the jersey	0
1247	the little male child is wearing a yellow army tank top and is laughing [SEP] a little male child is wearing a yellow army tank top and is laughing	0
1248	a white car and a yellow car are racing down the path [SEP] a white motorcycle and a yellow motorcycle are racing down the path	2
1249	a shirtless adult male is escorting a horse that is pulling a coach along a paved route [SEP] a shirtless adult male is escorting a horse that is pulling a coach along a route	0
1250	a adult male is reloading a scattergun [SEP] a adult male is firing a scattergun	2
1251	two child are playing on a statue [SEP] there are no child playing on a statue	1
1252	a young adult male is pushing a motocross motorcycle up a soil hill [SEP] some old soil rockers are getting a soil motorcycle up a sandy hill	2
1253	two child are rolling in dirty water [SEP] two boys are laying in the ocean close to the beach	2
1254	the adult male with the dyed purple hat is operating a photographic camera that makes picture [SEP] a adult male with a photographic camera is studying the theme	2
1255	the adult male on phase isnt singing into the mike [SEP] a adult male in a suit of clothes is standing at a mike and singing	2
1256	a adult female is talking on a phone [SEP] two boys are talking on the telephone	2
1257	a adult male and a adult female are hiking through a wooded country [SEP] a adult male and a adult female are walking together through the woods	0
1258	a yellow domestic dog is chasing a ball [SEP] a domestic dog is turning on the grass and pursuing a flying ball	2
1259	a adult male is mindlessly slicing the carrot with a machine [SEP] a adult male is slicing the carrot with a machine	0
1260	a mortal is chopping a red onion [SEP] a mortal is chopping an onion	0
1261	a girl in gold and purple is holding a rainbow afghan [SEP] a girl is carrying a lot of colorful scarf on the beach	2
1262	two people are standing in the ocean and watching the sundown [SEP] two people are standing in the ocean and looking at the sundown	0
1263	a adult male is cooking a serpent [SEP] there is no adult male cooking a serpent	1
1264	a black and white domestic dog is carrying a small stick on the green grass [SEP] a black and white domestic dog with a large arm is running in the field	2
1265	a domestic dog is pushing a tot into a rainfall puddle [SEP] a domestic dog is pushing a tot into a puddle of rainfall	0
1266	two men are fighting in a cows pen [SEP] two men are fighting in a pen for cows	0
1267	the men are putting bag into the bole of a car [SEP] the men are not packing bag into the bole of a car	1
1268	there is no adult female playing an electric guitar [SEP] a adult female is playing an electric guitar	1
1269	a adult male is doing back flips on a trampoline [SEP] there are no child jumping on a trampoline	2
1270	a horse is racing [SEP] there is no domestic dog racing on a path	2
1271	a adult female is cutting an onion [SEP] a adult male is slicing onions	2
1272	a adult male is hurriedly getting into a car in a garage [SEP] a adult male is getting into a car in a garage	0
1273	a adult male and a adult female are jumping on the kerb [SEP] a adult male and a adult female are standing on the kerb	2
1274	the true cat isnt licking milk from a disc [SEP] the true cat is hungrily drinking milk	2
1275	a male child wearing a striped shirt is running shoeless on the sandy hill [SEP] a girl wearing a striped shirt is running shoeless on the sandy hill	2
1276	the adult male is playing a game on a lawn [SEP] the rhinoceros is grazing on the grass	2
1277	a adult male is playing guitar [SEP] there is no adult male playing a guitar	1
1278	there is no mortal riding a motorcycle [SEP] a motorcycle rider in a black and red uniform is standing on a soil motorcycle	2
1279	two bmx rockers are jumping soil ramps in front of a organic structure of water [SEP] some rockers are not getting airborne on a path near water and a skyline	2
1280	a adult female is boiling noodles in water [SEP] a adult male is boiling noodles in water	2
1281	a female wearing pink mitt and a brown jacket is smiling in the snowfall [SEP] a young asian adult female with pink mitt is standing in the snowfall	2
1282	a girl has black and orange patches on the cheeks [SEP] a girl has colored patches on the cheeks	0
1283	a mortal is looking at a motorcycle designed for motocross that is lying on its side and another is racing by [SEP] a mortal is looking at a motocross motorcycle that is lying on its side and another is racing by	0
1284	the black and white domestic dog is running and a mortal stands behind it [SEP] a little domestic dog is slowing down and the proprietor is quitting chasing it	2
1285	a mortal is riding a jetski in the waves [SEP] a seadoo is being ridden by a adult female	2
1286	a adult male is mixing vegetables in a pot [SEP] a mortal is stirring vegetables in a pot	0
1287	a black and orange bird is standing in the grass [SEP] the black bird with a yellow beak is standing in the green grass	2
1288	a brown domestic dog is attacking another fauna in front of the adult male in drawers [SEP] two dogs are wrestling and hugging	2
1289	a adult female is slicing an onion [SEP] an onion is being sliced by a adult female	0
1290	two pandas are lying together [SEP] two panda bear bears are lying together	0
1291	an elderly adult female is sitting on a bench and is wearing a gray jacket and black drawers [SEP] an elderly adult male is sitting on a bench	2
1292	the adult male is standing on a rocky mount and gray clouds are in the background [SEP] the adult male is standing on a mount which is rocky and gray clouds are in the background	0
1293	a tiger is strolling around [SEP] a tiger rookie is making a sound	2
1294	the true cat is licking milk from a disc [SEP] the true cat isnt licking milk from a disc	1
1295	a domestic dog which is black and a white one are staring at each other in the street [SEP] one white domestic dog is staring at the black street	2
1296	there is no mortal playing a pianoforte [SEP] a mortal is playing a pianoforte	1
1297	there is no domestic dog licking a infant [SEP] a domestic dog is licking a infant	1
1298	a kid is smiling at the photographic camera and swimming submerged [SEP] an fauna is barking at a ball	2
1299	three people are standing by a bench under some thenar trees [SEP] three people are sitting on a bench under some thenar trees	2
1300	a few animals are playing in the water [SEP] nobody is playing ping niff	2
1301	a adult male is slicing a tomato [SEP] there is no adult male slicing a tomato	1
1302	a schoolgirl with a black bag is on a crowded railroad train [SEP] an asian adult female in a crowd is carrying a black bag	2
1303	there is no brown domestic dog jumping in the air [SEP] the brown domestic dog is jumping in the air	1
1304	two small boys dressed in tuxedos are sitting on a red carpeted floor [SEP] two small boys dressed in tuxedos are standing on a red carpeted floor	2
1305	two poodles are in the snowfall and one is jumping high [SEP] a grey domestic dog is jumping toward a black and white domestic dog in the snowfall	2
1306	a adult male is playing a transverse flute [SEP] the transverse flute is being played by a adult female	2
1307	a adult male is sprinkling shredded cheese on a pizza pie [SEP] a adult male is putting some cheese on a pizza pie	0
1308	two boys on a sofa are playing games on the video [SEP] two boys are playing a picture game	0
1309	the kitty is eagerly drinking some milk from the bowl [SEP] one small kid is greedily drinking water from the cup	2
1310	a group of people playing football game is running in the field [SEP] a group of football game players is running in the field	0
1311	the adult female is pouring oil into a frypan [SEP] a chimpanzee is angrily kicking a mark	2
1312	a tater is being sliced by the adult male [SEP] a adult male is slicing potatoes	0
1313	a adult female is cutting meat [SEP] a adult female is not cutting meat	1
1314	a male child is jumping off the side of a water fountain made of rock in front of a building [SEP] a male child is jumping off the side of a rock water fountain in front of a building	0
1315	there is no white domestic dog with beige floater running through a field [SEP] a tan domestic dog is running through the brushwood	2
1316	a domestic dog is running on concrete and is holding a blue ball [SEP] the large domestic dog is walking outside and is carrying a colorful plaything in its mouth	2
1317	a mortal is playing a pianoforte [SEP] there is no mortal slicing a tater	2
1318	a domestic dog is running on the earth [SEP] a girl is tapping her fingernails	2
