pair_ID	sentence_AB	E_judgment
2176	there is no adult male playing the pianoforte [SEP] a adult male is playing the pianoforte	1
2177	a young adult male and a adult female are riding bikes on the boardwalk near the ocean [SEP] a eye aged adult male and adult female are riding bikes down a route beside the water	2
2178	the adult male is hammering a nail with a photographic camera [SEP] the photographic camera adult male is nailing a cock to the wall	2
2179	two bmx rockers are jumping soil ramps in front of a organic structure of water [SEP] some rockers are getting airborne on a path near water and a skyline	2
2180	one adult male is sitting on the chair [SEP] the girl who is little is ruffling her hair	2
2181	the elderly lady is waiting on the pavement [SEP] a lady in a pelt hat and pelt coat is standing outside a building	2
2182	four young men are standing still and a car is exploding behind them [SEP] four young men are exploding and a car is standing still behind them	2
2183	three small dogs are sniffing at something [SEP] butter is being chopped into a container by a adult male	2
2184	the water ice field hockey goaltender is wearing a yellow jersey and is defending the end [SEP] a field hockey participant in a yellow jersey is guarding the end	0
2185	the adult female is cracking two eggs into a glass bowl [SEP] a adult female is cracking an egg into a bowl	0
2186	a adult male is performing stunts on a green bike [SEP] a adult male is performing a fast one on a green bike	0
2187	a skier dressed in black is catching a tiny spot of air [SEP] a adult male is skiing down a snowy hill	2
2188	football game players in red and white are jumping and hugging each other [SEP] a football game participant in a red and white uniform is being lifted by two teammates	2
2189	a adult male is playing an electronic keyboard [SEP] an electronic keyboard is being played by a adult male	0
2190	recruits are talking to an military officer [SEP] an military officer is talking to the recruits	2
2191	a infant is sitting [SEP] a infant is sneezing and scaring another infant	2
2192	a adult male is playing the drums [SEP] the drums are being played by a adult male	0
2193	someone is boiling okra in a pot [SEP] someone is cooking okra in a cooking pan	2
2194	a jet plane is not flying [SEP] a jet plane is flying	1
2195	a adult male in a blue jump suit is courageously performing a wheelie on a bike [SEP] the adult male is getting off a bike onto earth which is mostly barren	2
2196	a adult male is singing and playing the guitar [SEP] a adult male is singing a vocal and playing the guitar	0
2197	a keyboard is being played by a adult male [SEP] a adult male is playing a harp	2
2198	a shirtless adult male is escorting a horse that is pulling a coach along a paved route [SEP] a shirtless adult male is leading a coach that is being pulled by a horse	0
2199	a brown domestic dog is staring attentively at a brown and white domestic dog [SEP] the little domestic dog is dropping the bedchamber carpet slipper from its mouth	2
2200	a mortal is absently cutting mushrooms with a knife [SEP] a mortal is cutting some mushrooms	0
2201	a golden domestic dog is running through a field of tall grass [SEP] there is no brown domestic dog running through tall green grass	2
2202	the male child is cutting the grass by the kerb with pair of scissors [SEP] the male child is not cutting the grass by the kerb with pair of scissors	1
2203	people are dangling from straps and kicking at each other [SEP] nobody is dangling from straps and kicking at each other	1
2204	a adult male is emptying a container made of plastic completely [SEP] a adult male is emptying a container made of plastic	0
2205	a small male child in a green shirt is striping a sliding tube [SEP] a small male child in a striped shirt is sliding out of a green tube	2
2206	there is no football game participant in a purple jersey running with the ball for a touchdown [SEP] a football game participant is running past an functionary carrying a football game	2
2207	a adult male dressed in black is wearing inline skates and performing tumbling on a rail [SEP] a adult male dressed in black is wearing inline skates and performing a fast one on a rail	0
2208	a mortal is playing a trump [SEP] a adult male is passionately playing the guitar	2
2209	a adult male is speaking [SEP] there is no adult male speaking	1
2210	the white dogs are looking curiously at the black llama [SEP] a black sheep is standing near three white dogs	2
2211	a adult male is standing on a boat in front of the sundown near a flag [SEP] a adult male is on a boat in front of the sundown	0
2212	the kitty is eagerly drinking some milk from the bowl [SEP] one small kid is filling the cup with water	2
2213	the male who is dark shinny is standing on one hand in front of a yellow building [SEP] the dark shinny male is standing on one hand in front of a yellow building	0
2214	allium sativum is being chopped by a adult female [SEP] a adult female is chopping allium sativum	0
2215	some cheerleaders are taking a interruption [SEP] some cheerleaders are dancing	2
2216	a yellow true cat is chasing a ball [SEP] a yellow domestic dog is chasing a ball	2
2217	two men are not fighting [SEP] some men are fighting	2
2218	the adult male is pacing around a room [SEP] a adult male is sitting on the floor in a room and strumming a guitar	2
2219	a adult female is painting a mans human face [SEP] a adult female is cleaning a mans human face	2
2220	a snowboarder is doing a somerset over a hill of snowfall [SEP] somebody is jumping in the air on a board	2
2221	the adult female is not slicing an onion with a knife [SEP] the adult female is slicing an onion with a knife	1
2222	a adult male is walking in a metropolis street [SEP] a adult female is walking in a metropolis street	2
2223	a tater is being peeled by a mortal [SEP] a mortal is frying some nutrient	2
2224	a brown and white domestic dog is jumping over a red yellow and white hurdle [SEP] a brown and white domestic dog is passing under a red yellow and white hurdle	2
2225	a adult male is cutting a tomato [SEP] a adult female is dancing near a fire	2
2226	an elephant is being ridden by a adult female [SEP] a adult female is opening a sal soda and drinking it	2
2227	three men are not staring at the big green hills in the distance [SEP] three men are looking into the distance	2
2228	a domestic dog with golden pelt is in the water [SEP] a domestic dog with a golden coat is in the water	0
2229	a adult male is walking a adult female through the woods [SEP] the adult male and adult female are walking	0
2230	a adult male is squatting in brushwood and taking a picture [SEP] there is no adult male squatting in brushwood and taking a picture	1
2231	two people wearing helmets are riding over the yellow and white flowers [SEP] two people wearing helmets are driving over the yellow and white flowers	0
2232	two boys in white outfits and red protective cogwheel are sparring on a mat [SEP] two child in white outfits and red protective cogwheel are sparring on a mat	0
2233	child in swimming suits are playing in the pool [SEP] the child are wearing bathing suits and water is splashing around	2
2234	a white bird is swiftly taking off from the water [SEP] a white bird is landing swiftly in the water	2
2235	men are running a race [SEP] some racers are running down a path	2
2236	pedestrians and cars are moving through a traffic jam in the big metropolis [SEP] a adult male is breaking wooden boards with his hand	2
2237	a surfboarder is riding the moving ridge [SEP] there is no adult male tying a shoe	2
2238	a group of people is on a beach [SEP] four people are walking on the beach	2
2239	a adult male is talking on the wireless [SEP] a adult male is spitting	2
2240	the adult male is denying an interview [SEP] the adult male is granting an interview	1
2241	the doctors are healing a adult male [SEP] the doctors are reviving a adult male	0
2242	a adult male dressed in black and white is holding up the lawn tennis racket and is waiting for the ball [SEP] a racket is being held by a lawn tennis participant in mid game	2
2243	the brown domestic dog is spotting a black domestic dog and is playing in the dry grass [SEP] a grey silky domestic dog is lying in the grass and a brown domestic dog is looking on	2
2244	a visible light brown domestic dog is running in the water [SEP] a visible light brown domestic dog is sprinting in the water	0
2245	a blond girl waves while she is riding [SEP] a lady is surfing and riding a moving ridge	2
2246	four boys are kneeling next to each other in front of a ball [SEP] there are no boys kneeling next to each other in front of a ball	1
2247	a adult male is cutting a tree with an ax [SEP] a mortal is chopping down a tree with an ax	0
2248	a adult male is moving gracefully [SEP] a adult male is walking outside	2
2249	there is no young male child playing a air current instrument [SEP] a young male child is playing a air current instrument	1
2250	a adult female in a bikini is pulling a domestic dog on a lead at the beach [SEP] a adult female is standing at the beach with an fauna on a lead	2
2251	a motortruck is quickly going down a hill [SEP] some water is being casually drunk by a true cat	2
2252	a male child who is little is sitting in a green tunnel with a smile on his human face [SEP] a small male child in a striped shirt is sliding out of a green tube	2
2253	a keyboard is being played by a mortal [SEP] a mortal is playing a keyboard	0
2254	a young girl with a bosom army tank top is raising her hands as she is playing on a microscope slide [SEP] a blond kid is going down a microscope slide and throwing up his arms	2
2255	a child in orange is playing outside with a abronia elliptica [SEP] a snowfall ball is being made by a kid	2
2256	a girl in a black hat is wearing a bikini at the beach [SEP] a black girl with no bikini is wearing a hat at the beach	2
2257	a little black domestic dog is chasing a little brown domestic dog [SEP] a brown domestic dog and a black domestic dog are in the grass	2
2258	several young people are posing for a picture and holding beers [SEP] several young people are posing for a picture and holding drinks	0
2259	a young duet is lying on a bed together [SEP] a young duet is not lying in bed	1
2260	a male child is playing on a plaything [SEP] the adult male is aiming a gun	2
2261	a small male child in a yellow shirt is laughing on the beach [SEP] there is no small male child in a yellow shirt laughing on the beach	1
2262	vegetables are being put into a pot by a adult male [SEP] someone is pouring ingredients into a pot	0
2263	a adult male from the wilderness is on a walking way [SEP] a adult male is walking down a route	2
2264	a male child in a white tshirt is splashing in shallow water [SEP] a male child is running through the water at the beach	2
2265	the large brown domestic dog is running outside in the soil [SEP] a domestic dog is sitting by a fence on a soil path	2
2266	there is no adult male screaming [SEP] a adult male is crying	2
2267	the motocross rider is standing naked [SEP] a biker with a blue jacket black drawers and a white helmet is driving on soil and people are watching	2
2268	the girl in the blue and white uniform is cheering [SEP] the girl is cheering the adult male in the blue and white uniform	2
2269	two dogs are playing by a tree [SEP] two dogs are playing by a works	0
2270	a bicyclist is biking in a snowy wood at dark [SEP] the rider is biking in the snowfall and wearing a red jacket	2
2271	a group of asian girls are standing together [SEP] two girls are laughing breathlessly and other girls are watching them	2
2272	a big true cat is opening a plastic drawer with its paws and is jumping inside [SEP] a true cat is opening a drawer and jumping inside	0
2273	a mortal is not stirring vegetables in a pot [SEP] a adult male is mixing vegetables in a pot	2
2274	a male child is spanking a adult male with a plastic sword [SEP] a male child is spanking a adult female with a plastic sword	2
2275	a adult female in a black frock is pulling a cart and is standing in front of two men who are seated on a parkland bench [SEP] a male child is wearing a black frock and is carrying a white cross	2
2276	there is no panda bear climbing [SEP] a panda bear is climbing	1
2277	a mortal is strongly whisking eggs in a bowl [SEP] one adult female is beating two eggs in the bowl and using a whisk made of wire	2
2278	a adult female is slicing allium sativum [SEP] a adult female is cutting allium sativum	0
2279	a yellow domestic dog is running up a sandy way [SEP] a golden retriever is running	2
2280	the adult male with brown hair is wearing shades and is sitting listlessly at a table with cans of sal soda and other drinks [SEP] a young adult male with brown hair and shades is sitting in front of some cans of sal soda	0
2281	the adult male is putting poulet into the container [SEP] a adult male is putting some nutrient in a box	0
2282	a young girl is wearing a blue patterned swim suit of clothes a black and yellow swim cap and has blue swimming goggles on her head [SEP] a little girl is wearing a blue patterned swim suit of clothes a black and yellow swim cap and has blue swimming goggles on the head	0
2283	two dogs are running and carrying an physical object in their mouths [SEP] a domestic dog is chasing a stick and holding another domestic dog in its mouth	2
2284	there is no motorcyclist riding a minibike along a roadway [SEP] a motorcyclist is riding a minibike along a roadway	1
2285	a adult female is playing the trump [SEP] a adult male is playing the trump	2
2286	a adult female is cooking eggs [SEP] the adult female is cooking something	0
2287	a adult male is watering the grass and excitedly playing with a domestic dog [SEP] the domestic dog is snapping at some droplets of water	2
2288	a adult male is playing a harp [SEP] a adult male is harping on about a play	2
2289	the crowd is watching a football game game [SEP] the crowd is not watching a football game game	1
2290	a adult female is boiling eggs [SEP] eggs are being boiled by a adult female	0
2291	a black and white domestic dog is holding a baseball game in its mouth [SEP] a black and white domestic dog is dropping a baseball game from its mouth	2
2292	two dogs are playing by a tree [SEP] there is no domestic dog leaping in the air	2
2293	two child are rolling in dirty water [SEP] two child are rolling in muddy water	0
2294	the people are not sitting on a bench in front of a eatery [SEP] three people are sitting on a bench under some thenar trees	2
2295	a domestic dog is jumping in the shadiness of some trees [SEP] a domestic dog is jumping on a trees in the sunglasses	2
2296	a adult male with a jersey is dunking the ball at a basketball game game [SEP] a adult male who is playing dunks the basketball game into the net and a crowd is in background	2
2297	a domestic dog which is furry and black is in a back pace and is carrying a handbasket in its mouth [SEP] a domestic dog next to a tree which is probably a pine tree is dropping a pail	2
2298	a bald mortal is playing a guitar [SEP] a mortal has blonde and flyaway hair and is playing a guitar	2
2299	a male child is standing in the cold water [SEP] a male child is standing in the water	0
2300	the young male child in the blue shirt is not jumping into the water [SEP] the young male child in the blue shirt is jumping into the water	1
2301	people are sitting at square tables in a red room [SEP] people are sitting at tables in a red room	0
2302	a adult female is cutting meat [SEP] there is no adult female cutting an onion	0
2303	a young occidental girl is standing above the crowd and is playing with a aeonium haworthii [SEP] a girl in blue jumper is holding a multi-color plaything and is sitting on the shoulders of a adult male with grey hair	2
2304	a cold bicyclist is celebrating [SEP] a cyclist is holding a motorcycle over his head in a group of people	2
2305	a brown domestic dog is running through tall green grass [SEP] a golden domestic dog is running through a field of tall grass	2
2306	a domestic dog is chasing a ball [SEP] the domestic dog is not catching a blue ball	2
2307	the women are not dancing outside [SEP] the women are dancing outside	1
2308	a adult male is reading an e-mail [SEP] a mortal is peeling a banana tree	2
2309	a mortal is wearing a hat and is sitting on the grass [SEP] a mortal is sitting in a field and is wearing a hat	2
2310	a large black domestic dog is jumping in the air over a snowy country [SEP] a large white domestic dog is jumping in the air over a snowy country	2
2311	a black domestic dog with a red neckband is putting its human face in the water [SEP] a black domestic dog is standing in shallow water	2
2312	a adult male is talking [SEP] a adult male is dancing	2
2313	a brown and white domestic dog is passing under a red yellow and white hurdle [SEP] a large brown domestic dog is jumping over a red hurdle	2
2314	a group of child in a christian church cellar is playing maracas and tambourines [SEP] a group of child is playing tambourines	0
2315	a adult male is flooring a sitting guitar participant [SEP] a adult male is sitting on the floor in a room and strumming a guitar	2
2316	a herd of cervid is crossing the street [SEP] one herd of cervid is crossing the street	0
2317	a black and orange bird is standing on the lawn [SEP] a black bird with a yellow beak is standing in the green grass	2
2318	the snowboarder is jumping off the snowfall [SEP] a snowboarder is jumping off the snowfall	0
2319	a adult male is freeing a fish [SEP] a adult male is catching a fish	2
2320	a brown and white domestic dog is playing on the grass [SEP] a brown and white domestic dog is playing on the lawn	0
2321	a adult male is shooting a arm [SEP] a adult female is riding a horse	2
2322	the orange delivery boat is not rushing across the water [SEP] the orange delivery boat is rushing across the water	1
2323	a panthera leo is slowly walking [SEP] a panthera leo is slowly moving around	0
2324	a young male child is singing and playing a guitar [SEP] a child is playing the guitar	0
2325	a girl from asia in front of a brick window doesnt look surprised [SEP] a girl is wearing a tshirt and has her mouth open	2
2326	the pianoforte is being played by someone [SEP] nobody is feeding an fauna	2
2327	three child are running down hill [SEP] three child are running up a grassy hillside	2
2328	a mortal is making a bed [SEP] a mortal is eating at a table	2
2329	association football players are kicking a association football ball into the end [SEP] there are no association football players kicking a association football ball into the end	1
2330	a child wearing a striped shirt is running shoeless on the sandy hill [SEP] a male child is running through the sand	0
2331	the domestic dog is biting some droplets of water [SEP] the domestic dog is snapping at some droplets of water	0
2332	a infant is laughing [SEP] a infant is crying	2
2333	a adult male is talking to a adult female [SEP] a adult female is breaking eggs	2
2334	a mortal is brushing a true cat [SEP] a mortal is combing the pelt of a true cat	0
2335	a brown puppy is gnawing a metallic station that is stuck in the earth [SEP] a malnourished looking domestic dog is standing on its hind legs and preparing to leap	2
2336	a mortal on a motorcycle is not in the air near a organic structure of water [SEP] a mortal on a motorcycle is in the air near a organic structure of water	1
2337	a kid in visible light colored clothing is standing with his arms extended outward [SEP] two girls are happily playing inside a jumper house	2
2338	the kid is splashing water in a small blue pool [SEP] the kid is splashing water in a pool	0
2339	the mortal is playing with a skull [SEP] the adult male is playing the guitar	2
2340	a male child is mowing the lawn [SEP] a adult male is mowing grass	2
2341	the male child who is young is running through the ocean waves [SEP] a kid is running in and out of the ocean waves	0
2342	a adult male is singing into a mike [SEP] a adult male is sitting in the rainfall	2
2343	two cat are sitting around a table and holding beers in their hands [SEP] a adult male in a white shirt and shades and a adult male in a black shirt and shades are sitting at a table with four bottles of beer	2
2344	a brown and white true cat is jumping on the pavement [SEP] a brown and white domestic dog is jumping on the pavement	2
2345	a adult male is sprinkling seasoning on several sliced and buttered loaf of breadstuff [SEP] a adult male is removing the allium sativum from some piece of breadstuff	2
2346	a adult male on a yellow soil motorcycle is taking a leap [SEP] a bicyclist on a yellow motorcycle is airborne	0
2347	a race car driver is standing up and is fiercely pointing his hand at the sky [SEP] the mortal in the blue jacket is wearing a colorful helmet	2
2348	a male child and a girl in swimsuits are wearing arm floats [SEP] the male child and the girl are playing and wearing arm floats	2
2349	a adult male is cutting a note [SEP] a adult male is cutting a paper	0
2350	a domestic dog in a colored coat is running across the pace [SEP] a domestic dog in the pace is running across colored coats	2
2351	a domestic dog which is black is running in the grass [SEP] a black domestic dog is running in the grass	0
2352	a mortal near an onion has a cut [SEP] a mortal is cutting an onion	2
2353	a adult male is jumping into a pool [SEP] a adult male is diving into a pool	0
2354	a adult male in a white shirt and shades and a adult male in a black shirt and shades are sitting at a table with four bottles of beer [SEP] a adult male in a white shirt and shades and a adult male in a black shirt and shades are sitting at a table with four beer bottles	0
2355	a adult female is riding a seadoo [SEP] there is no mortal riding a jetski in the waves	1
2356	five child are standing in a wooden army hut [SEP] five child are standing close together and one child has a gun	2
2357	a adult male is hungrily eating a bowl of cereal grass [SEP] the adult male is eating cereal grass	0
2358	an onion is being cut by a adult male [SEP] a adult male is eating onion piece	2
2359	some fish are swimming [SEP] a fish is swimming	0
2360	a adult female who is old is near a domestic dog that has a white coat [SEP] a adult female who is old is near a white domestic dog	0
2361	there is no true cat hungrily drinking milk [SEP] the true cat is hungrily drinking milk	1
2362	a door is being opened by a adult male [SEP] a bald adult male in a band is playing guitar in the limelight	2
2363	a adult male is performing tricks with a association football ball [SEP] a adult male is running away from the association football ball	2
2364	an water ice skating skating rink placed outdoors is full of people [SEP] there arent many people in the water ice skating parkland	1
2365	a kid is swimming submerged in a pool [SEP] a kid is swimming on the waters surface in a pool	2
2366	a cyclist is performing a fast one over a clean wall [SEP] a bicyclist is performing a leap on a bike	2
2367	a black adult male is walking next to a building in a big metropolis [SEP] a adult male is looking into the distance and people is walking between buildings behind	2
2368	a mortal is scrubbing a courgette [SEP] a adult female is eating courgette and vegetables and scrubbing with a brushwood	2
2369	people are riding two camels at the beach [SEP] people are riding two camels on the sand	0
2370	a kid who looks young is standing in front of some trees [SEP] a small male child is standing in the wood	2
2371	an inflatable crocodile is being pushed by two child in a pool [SEP] two child are pushing an inflatable crocodile in a pool	0
2372	a red sledge is being held by a little girl in a green coat and a male child walking in the snowfall [SEP] a little girl in a green coat and a male child holding a red sledge are walking in the snowfall	0
2373	a mortal is holding a bum [SEP] a mortal is not frying meat in a cooking pan	2
2374	an old adult female is carrying a lot of colorful scarf on the beach [SEP] a young adult female is carrying a lot of colorful scarf on the beach	2
2375	the little male child is riding a bike in a race [SEP] a bike is being ridden by the little male child in a race	0
2376	a band is playing some instruments [SEP] a adult male is playing an electronic keyboard	2
2377	the helmeted girl is riding a motorcycle [SEP] a adult female is performing a fast one on a incline with a bike	2
2378	two white dogs are playing with a brown domestic dog and a lawn tennis ball [SEP] two white dogs and one brown domestic dog are chasing a ball	2
2379	two boys are studying [SEP] two boys are playing a picture game	2
2380	a large white domestic dog is jumping in the air over a snowy country [SEP] a small white domestic dog is jumping up in the snowfall	2
2381	a few people are floating on a raft [SEP] people are riding and paddling a raft	2
2382	a hurdle is being leapt by a horse that has a rider on its back [SEP] a horse is leaping a hurdle and has a rider on its back	0
2383	the american football player is not wearing a red and white strip [SEP] a football game participant is wearing black armbands	2
2384	some boys being dressed with a carpet are sitting on two red tuxedos [SEP] two little boys are wearing tuxedos	2
2385	the men are packing bag into the bole of a car [SEP] the men are in the bag that are being packed in the bole of a car	2
2386	an water ice skating skating rink placed outdoors is empty [SEP] an water ice skating skating rink placed outdoors is full of people	1
2387	two women are sparring in a kickboxing match [SEP] two people are kickboxing and spectators are not watching	2
2388	a adult male is playing a guitar [SEP] someone is playing a pianoforte	2
2389	the lady is picking up the kangaroo [SEP] the adult female is picking up the kangaroo	0
